content,content_stem,score,target
"Can you fix your search bar, i think there's a bug, everytime i try to search, it always go back to the homepage. i already try restarting my phone and uninstalling the apps but its still the same i cannot use the search option",fix search bar think bug everytim tri search alway go back homepag alreadi tri restart phone uninstal app still cannot use search option,3,1
Easy n useful apps,easi n use app,5,0
Good,good,4,0
A trustworthy shopping experience eith shopee. Thanks,trustworthi shop experi eith thank,5,0
Very slow,slow,2,1
Dispute on failed delivery will eventually get awarded to seller. Buyers will always be on the losing end in shoppee.,disput fail deliveri eventu get award buyer alway lose end,1,1
Horrible UI with a returns/refunds process designed to confuse. One of the reasons I don't mind paying more for Amazon US or US vendors - you get unparalleled customer service. Won't be using this platform again.,horribl ui return refund process design confus one reason mind pay amazon us us vendor get unparallel custom servic use platform,1,1
Good platform with a decent variety of products,good platform decent varieti product,5,0
Wide variety of items to select from. Easy payment n taking!,wide varieti select easi payment n take,5,0
Positive,posit,5,0
"Everything is good however just on the parts where many sellers actually dont reply to chats within the app which defeats the purpose of the ""message"" function. Maybe you guys can improvise on the chat system such as to provide benefits when customer buys and ""rate"" the seller instead of just rating the product.",everyth good howev part mani actual dont repli chat within defeat purpos messag function mayb guy improvis chat system provid benefit custom buy rate instead rate product,4,0
For products with multiple purchase options I am not able to scroll down and place order on my android phone,product multipl purchas option abl scroll place order android phone,3,1
"Greats online shopping platform. Looking forward for improvement with more good deal, affordable price, and better service.",great onlin shop platform look forward improv good deal afford price better servic,5,0
Easy to use,easi use,4,0
"My son: I like this company as it sells my things, such as glue guns and pajamas and as for daddy, a table.",son like compani sell thing glue gun pajama daddi tabl,5,0
Not nice at all. Been trying to get an item for past 1 week plus. 2 sellers never send on shipping dates and totally unresponsive. Total waste of time better to stick back to Amazon.,nice tri get past week plu never send ship date total unrespons total wast time better stick back amazon,1,1
Easy to use,easi use,4,0
Would be great if Shopee can accept payment by Nets.,would great accept payment net,5,0
"Please avoid using this platform especially if you are doing big purchases. I felt like being scammed by them. They gave huge shopee coins promotion but the validity of the coins are only a mere 2 months. During which, all other purchases to use these earned coins are limited in quantity. They do not allow the usage of all the coins one shot. They are not really an essentials only store where you can spend regularly. So end up the coins will just be forfeited. I lost $60 worth of coins.",pleas avoid use platform especi big purchas felt like scam gave huge coin promot valid coin mere month purchas use earn coin limit quantiti allow usag coin one shot realli essenti store spend regularli end coin forfeit lost worth coin,1,1
amazingly affordable and convenient,amazingli afford conveni,5,0
"The page takes forever to load at payment page. Whether successful or not, 
no idea at all!!!",page take forev load payment page whether success idea,1,1
Not bad. Quite fast delivery n sellers mostly responsive.,quit fast deliveri n mostli respons,5,0
"I made the bank transfer but could not upload the payment receipt due to their poor system, and now they just cancelled my order. Lousy system that doesn't allow use of credit card",made bank transfer could upload payment receipt due poor system cancel order lousi system allow use credit card,1,1
Goods not received but have to pay for it. What app is this? BUY AT YR OWN RISK.,good receiv pay buy yr risk,1,1
Took super long time to receive the parcel.,took super long time receiv parcel,1,1
Easy shopping and enjoying purchase,easi shop enjoy purchas,5,0
"been buying my item from shopee till i came across this BBMSG seller. Really shopee sided the seller as i m not sure how we going to trust this online again. Brought the item, item doesnt fix into my model, col also don't match, but seller insisted she right n so unfriendly, wanted to refund but seller dispute it and shopee anyhow released the payment and funds. Really a salute that shoppe assist all this scams gonna delete the apps and use back my Ezbuy which i have been using for 2 yrs back.",buy till came across bbmsg realli side sure go trust onlin brought doesnt fix model col also match insist right n unfriendli want refund disput anyhow releas payment fund realli salut shopp assist scam gonna delet app use back ezbuy use yr back,1,1
"The apps keep hanging everytime i scroll to flash deal. Halfway scroll surely hang. Got to close the app and start scrolling again. This has been happening for a week. I tot it was my network. But nope, its this app development is lagging. Pls look into it.",app keep hang everytim scroll flash deal halfway scroll sure hang got close start scroll happen week tot network nope develop lag pl look,3,1
Popup hell. As I'm working Shopee spams me with cny sale etc many times a day. It's very very annoying,popup hell work spam cni sale etc mani time day annoy,1,1
Can I ask here if can use atm card for shop online?,ask use atm card shop onlin,3,1
Easy to use platform. Prices are reasonable and plenty of choices.,easi use platform price reason plenti choic,5,0
Very fast delivary..,fast delivari,4,0
Love the escrow system as well as helpful support staff. Keep up the good work!,love escrow system well help support staff keep good work,5,0
"I cannot water my plant on shopee farm! It keeps hanging... it is very disturbing, fix this problem ASAP!!!",cannot water plant farm keep hang disturb fix problem asap,1,1
Disappointed for local (home delivery) not improve the service. Now become downgrade the service. Local delivery more than a week to receive. (but shopee write local delivery will 1-3 working days). I have most of the times use this app to purchase my online items. Last time very good. But now the delivery is very bad. Local seller same day handover the item to (home delivery company) but I know don't why the delivery company keep more then 5 days in they store.If improved i will 5 star.,disappoint local home deliveri improv servic becom downgrad servic local deliveri week receiv write local deliveri work day time use purchas onlin last time good deliveri local day handov home deliveri compani know deliveri compani keep day store improv star,1,1
Great,great,5,0
Please tell us what happened to the app. It logged out suddenly and now I have difficulty logging back in. I have an order to track and to receive but now I am not able to track it!,pleas tell us happen log suddenli difficulti log back order track receiv abl track,2,1
"This is the most troublesome shopping app that i ever used. it is not user friendly at all and the moment when you place an order, it create chaos by compulsorily required is to key in new number as verification (which i dont how this serve its purpose). Secondly, it doesnt show that certain item have purchase limit. it only pops up when you try to make payment.",troublesom shop ever use user friendli moment place order creat chao compulsorili requir key new number verif dont serv purpos secondli doesnt show certain purchas limit pop tri make payment,1,1
"Overall an amazing app for shopping, but has some problems with loading and is a little laggy sometimes",overal amaz shop problem load littl laggi sometim,5,0
Awesome,awesom,5,0
"bad experience my first buy in shoppe bot 3 items & paid one seller told me no stock & cancel my order another seller I bit 2 items & only deliver 1, when I chat only then told me another item no stock. I asked for refund, replied me ok but no refund receive",experi first buy shopp bot paid one told stock cancel order anoth bit deliv chat told anoth stock ask refund repli ok refund receiv,2,1
the app is slow and crashes frequently on my android phone,slow crash frequent android phone,3,1
Complicated app!! cant even managed to login.. 😢,complic cant even manag login,1,1
"Please improve the scrolling and page loading speed. It is especially slow and 'stucks' when scrolling the listing, as compared to ""C"".         Will give 4 stars instead if this is fixed.",pleas improv scroll page load speed especi slow stuck scroll list compar c give star instead fix,2,1
Responsible,respons,5,0
"Preparation for shipping takes way too long, 2 weeks!",prepar ship take way long week,2,1
Good. Like it,good like,5,0
"Very easy to buy products daily. Mostly fast delivery, great app to compare products and its prices unlike other online shopping.",easi buy product daili mostli fast deliveri great compar product price unlik onlin shop,5,0
Good place to shop.,good place shop,5,0
"Saw the 1 time free gift for New users.When I chk out for it,I was told not entitled to it coz only for FIRST time chk out.U guys didnt state clearly.I'm definitely NEW user.Pls define clearly in Bold sentence that its meant for FIRST chk out.I clicked for it after 3rd purchase coz I had the impression I can click for NEW USER free gift as I had nvr click before.Dont like this kinda loophole.I felt cheated n deprived of my rights.Whatever! Pls kindly dont gimme standard reply with no substance!",saw time free gift new user chk told entitl coz first time chk u guy didnt state clearli definit new user pl defin clearli bold sentenc meant first chk click rd purchas coz impress click new user free gift nvr click dont like kinda loophol felt cheat n depriv right whatev pl kindli dont gimm standard repli substanc,1,1
"lack of support from Shopee on return of faulty items aka poor buyer protection , i would rather use Lazada or Ezbuy. Never gonna use Shoppee again",lack support return faulti aka poor buyer protect would rather use lazada ezbuy never gonna use,1,1
The most user friendly platform. Easy and simple reward system which i like the most compared to other platforms.,user friendli platform easi simpl reward system like compar platform,4,0
"It is the best ! And i spend a lotttt 😅😅😅 oh no , but its very efficient ! Thank you shopee ! AGAIN COINS ALERT",best spend lotttt oh effici thank coin alert,5,0
What nonsense. The PlayStation sale is not even on sale. Prices are the same as retailers and yet call it sales.,nonsens playstat sale even sale price retail yet call sale,1,1
"Worst App. Returns are almost impossible. Sellers are very adamant, quality of cloths are also not good. Sizes and measurements are not appropriate, always misleads the cuatomer.",worst return almost imposs adam qualiti cloth also good size measur appropri alway mislead cuatom,1,1
beginning Top-up 20% off still 20% off but when I'm purchases became only 10% off please fixing it,begin top still purchas becam pleas fix,1,1
"1. Please lock screen for typing of product description. Not able to see the text being keyed can be frustrating. 2. Payment to sellers can be expedited. While we make the effort to provide a good customer experience, we hope to be paid promptly too. Perhaps add c.o.d as another option. 3. For edit of photos, eg. Brightness, on top of sliding, can you add in plus and minus? It is easier for minute changes. Thank you very much.",pleas lock screen type product descript abl see text key frustrat payment expedit make effort provid good custom experi hope paid promptli perhap add c anoth option edit photo eg bright top slide add plu minu easier minut chang thank much,3,1
Lag at times. But over all good,lag time good,4,0
Buy my ring on my friend hp i can found the sell on my hp,buy ring friend hp found sell hp,1,1
Good service.,good servic,5,0
Getting bad this app. Keep jammed n jammed,get keep jam n jam,1,1
I am very satisfied with the app and the services Shower has made my shopping experience much easier and Safer.No huss no fuss.I really enjoy with Supper.,satisfi servic shower made shop experi much easier safer huss fuss realli enjoy supper,5,0
its great,great,5,0
"Shopee has great deals. However, the app is really slow and crashes a lot. Have to close the app and open it again to use it smoothly especially when about to check out. Please fix it. Thanks.",great deal howev realli slow crash lot close open use smoothli especi check pleas fix thank,3,1
easier purchase experience. great!,easier purchas experi great,5,0
"The Shopee games such as Shopee Throw & Mystery Box are not loading properly. I keep ending up with black/white blank screens. No matter how many times I refresh my app, restart my phone & reinstall the app. Now I'm losing out in all the fun for collecting the Shopee coins to get discounts -_-...... And I don't even know what's the problem. Shopee, please fix this issue/error/bug asap, I want my Shopee coins too.",game throw mysteri box load properli keep end black white blank screen matter mani time refresh restart phone reinstal lose fun collect coin get discount even know problem pleas fix issu error bug asap want coin,2,1
Great app!,great,5,0
Get very good deals at great pricing.,get good deal great price,5,0
They have hands down the WORST customer service ever. Don't shop on this platform if your don't want your blood boiling lol.,hand worst custom servic ever shop platform want blood boil lol,1,1
"Experience is smooth , just that shoppee say will pay $5 discount for me but never",experi smooth say pay discount never,3,1
"Great online shopping experience, although there are fake items in it like other online shopping, but I think shopee handle it wells and refund fast if you got spoil or fake product.",great onlin shop experi although fake like onlin shop think handl well refund fast got spoil fake product,5,0
"Very easy to use, track goods n fast delivery. Will continue to explore more. 👍👍👍👍👍",easi use track good n fast deliveri continu explor,5,0
Still can't process orders after 3 weeks !,still process order week,2,1
"Been using to purchase some stuff ever since the ezbuy saga. And I like that they constantly have sales going on. But how do you expect people to buy stuff if we can't even load the payment page? It's 2326, and the sale ends 2359 tonight and imma miss out on this sale so im low key annoyed because this is about the 5th time I've experienced this problem. I like your app, but fix that please. Thank you.",use purchas stuff ever sinc ezbuy saga like constantli sale go expect peopl buy stuff even load payment page sale end tonight imma miss sale im low key annoy th time experienc problem like fix pleas thank,3,1
"good for discounts, but need a better search algorithm",good discount need better search algorithm,4,0
Very good 👌,good,5,0
"Less than a month since joining Shopee & experience the following, 1-notify got voucher but voucher not in system during checkout. There's ghost in the system? 2-all reminder only appear after the events had finish. Am i suppose to set alarm clock by myself? 3-delivery never came but system prompt delivered with a don't know who's singature. This is really bad, not trust worthly & thinking of closing it for good!",less month sinc join experi follow notifi got voucher voucher system checkout ghost system remind appear event finish suppos set alarm clock deliveri never came system prompt deliv know singatur realli trust worthli think close good,1,1
"I always use this app to purchase stuffs online, it's a really gd online shopping app but recently the home page cannot load and sometimes it loaded but the pg is zoomed in and things are all over the place, pls fix this problem, other than that it's a good app.",alway use purchas stuff onlin realli gd onlin shop recent home page cannot load sometim load pg zoom thing place pl fix problem good,3,1
Recently loading fails. Cannot view products. Cannot make payment. Lazada app respond better.,recent load fail cannot view product cannot make payment lazada respond better,1,1
"Overall mobile app functioning well, but unable to change payment method, after you have selected ""place order"". Helpdesk chat bot only gave a series of steps to uninstall app, check network connection, or try on desktop. In the end, desktop version able to select change payment. Feedback to developer to include changing of payment method after selecting ""place order"".",overal mobil function well unabl chang payment method select place order helpdesk chat bot gave seri step uninstal check network connect tri desktop end desktop version abl select chang payment feedback develop includ chang payment method select place order,2,1
Please Fix this Asap!! as i order my stuff here and it ask to tap to reload but it didnt come out anything !,pleas fix asap order stuff ask tap reload didnt come anyth,1,1
"Shopee very helpfull on circuit breaking period, where almost all the shoping mall are closed. This app easy use, just order, paid & wait your item. Normaly delivery take 2weeks. Hope can be faster. Thanks",helpful circuit break period almost shope mall close easi use order paid wait normali deliveri take week hope faster thank,5,0
"First time order ,some stores very good and trusted do ask the stores before you click on item to purchase in this covid 19 epidemic time.stay safe ya",first time order store good trust ask store click purchas covid epidem time stay safe ya,5,0
Very user friendly and easy to use platform.,user friendli easi use platform,5,0
"1st time trying and got a bad experience. After waiting so long for my item, seller did not respond. Need to refund awaiting for approval.",st time tri got experi wait long respond need refund await approv,1,1
Prefect online shopping apps. What you pay is what you get so you can compare the prices for similar products or brands. Awesome.,prefect onlin shop app pay get compar price similar product brand awesom,5,0
I don't like ads,like ad,3,1
nice,nice,4,0
"Sometimes for no reason, the shopee app logs me out and gives me an error message and i am unable to access my account. However overall experience has been pleasant with sellers.",sometim reason log give error messag unabl access account howev overal experi pleasant,4,0
"Lousy experience. The system did not register me as a new user when this is my first time using the app. Customer service gives standard response and did not offer solutions, and promotions are not as attractive as other competitors.",lousi experi system regist new user first time use custom servic give standard respons offer solut promot attract competitor,1,1
"The shoppe need to improve the shipping status. It said that it will ship out by 9 Oct 19, but then it has been so long and the status did not update, the seller told it is shipped out by shoppe did not give any updates.",shopp need improv ship statu said ship oct long statu updat told ship shopp give updat,2,1
Since yesterday i got problem checking out,sinc yesterday got problem check,2,1
The app won't send me the text message so I can verify my phone number,send text messag verifi phone number,3,1
Good service,good servic,5,0
Add a function to delete old notifications.,add function delet old notif,3,1
"Few times shopee coins were not updated. Lucky rat in flip and match (few times), survey points, rate & comment points.",time coin updat lucki rat flip match time survey point rate comment point,2,1
Only reason for not 5star is because it lets sellers advertise items that they are already out of stock for.,reason star let advertis alreadi stock,4,0
"Good shopping app. Can go overboard shopping all the good stuff, especially household items. A little buggy at times hence the 4 stars (products page sometimes won't load, but rarely).",good shop go overboard shop good stuff especi household littl buggi time henc star product page sometim load rare,4,0
No hidden plus plus like q10.,hidden plu plu like q,5,0
Prompt response and delivery from seller. Items are usually tally with descriptions and photo.,prompt respons deliveri usual talli descript photo,5,0
"The app has been quite good, always have interesting games to win coins except maybe the timing to play a bit odd for working people.",quit good alway interest game win coin except mayb time play bit odd work peopl,4,0
"First time user.. find it very convenient, affordable price really tempting... fast delivery if the products is in sg.....",first time user find conveni afford price realli tempt fast deliveri product sg,5,0
Good varieties at very low prices.,good varieti low price,5,0
"Not exactly good experience shopping on shopee. App pages loading very slowly, vouchers claimed but not shown in my wallet. Please improve on these issues.",exactli good experi shop page load slowli voucher claim shown wallet pleas improv issu,1,1
Order confuse,order confus,3,1
great experience shopping online during on/off circuit breaker,great experi shop onlin circuit breaker,5,0
So many disc n worth the money.,mani disc n worth money,5,0
Nice app. Fast delivery and good product can find here .thanks,nice fast deliveri good product find thank,4,0
Vry good for buy e things n delivery it to home after receiving e msg,vri good buy e thing n deliveri home receiv e msg,5,0
I hope the shopee management take note on those seller keep cancel the buyer order due to they cant shio out the item due to the selling price they disnt update and do they work on it. Is very irresponsible n unreliable. 200315UQRW4EXP aa for this paced twin order and wait for it end up just cancel without informing. Ask the seller only use the generate message to responce on it also don't even reply what you ask.,hope manag take note keep cancel buyer order due cant shio due sell price disnt updat work irrespons n unreli uqrw exp aa pace twin order wait end cancel without inform ask use gener messag responc also even repli ask,1,1
Improved now. Need better customer services. Long time for refund.,improv need better custom servic long time refund,3,1
Nice and true,nice true,4,0
"One of the seller increased the product(mask) price and choose not to ship out my item, it's so unethical. However shopee customer service cant do anything to it.",one increas product mask price choos ship uneth howev custom servic cant anyth,1,1
"Great , top Online Market App",great top onlin market,5,0
It's convience,convienc,5,0
"Horrible experience. Bought 3 items from same seller. Never received the items. Asked for refund. Shoppee so-called investigation finding: seller has proof that items are shipped. Pls check with neighbours or post box or use tracking number to check with delivery company. And without my consent, payment was released to seller. The buyer has no right on this platform. Horrible. Worst shopping app I ever used.",horribl experi bought never receiv ask refund call investig find proof ship pl check neighbour post box use track number check deliveri compani without consent payment releas buyer right platform horribl worst shop ever use,1,1
"Scam apps! if able give ""0"" star. i will be more than happy. sellers are cheaters. shopee doesnt help much too. items too cheap to be believe...",scam app abl give star happi cheater doesnt help much cheap believ,1,1
My favourite online shopping platform. I like the layout,favourit onlin shop platform like layout,5,0
Why in the world is my verification code not working?????!!!!,world verif code work,2,1
Excellent,excel,5,0
Apps was good but slowdown on realtime updates during festive sales due to traffic,app good slowdown realtim updat festiv sale due traffic,4,0
the best online shopping app in Singapore!,best onlin shop singapor,5,0
Very good,good,5,0
Enjoyed this app with good pricing,enjoy good price,5,0
Good experience with the user interface. Easy to use and track my deliveries.,good experi user interfac easi use track deliveri,5,0
"Prices on shopee, after factoring in coins, are generally cheaper than other platforms.",price factor coin gener cheaper platform,4,0
"Its frustrating!!!! Keep asking for verification code. How many times do I have to do that???? Have to reset password every time I login. Then when go to bank transfer payment, encountered server error. Switch to credit card payment, cannot go through. Crappy app!!!",frustrat keep ask verif code mani time reset password everi time login go bank transfer payment encount server error switch credit card payment cannot go crappi,1,1
"No complete. But writing give me a order completed.if can give photo.i can 
show.its mall . Please don't use this app. The shop is very big Alibaba 
take people money and don't want to keep your think. Lost money and waste 
time.",complet write give order complet give photo show mall pleas use shop big alibaba take peopl money want keep think lost money wast time,1,1
The products r cheaper but some sellers' attitude not nice if u didn't give good comments.,product r cheaper attitud nice u give good comment,4,0
this app I search for so many items don't have dislike,search mani dislik,1,1
It's a good online shopping app. There is a lot of item that can be found here. So far satisfied with it. I get what i want. Although shipping is delay and took quite long to received but it's worth waiting for cause the quality is good and received as described👍👍👍😊,good onlin shop lot found far satisfi get want although ship delay took quit long receiv worth wait caus qualiti good receiv describ,5,0
Fast and hassle free,fast hassl free,5,0
Good place to shop your item,good place shop,5,0
