content,content_stem,score,target
"it was okay but really frustrated during check out due to server error. this is the second time I am experiencing it and even cleared cache, logged out, logged in, uninstalled and reinstalled but server error still exist on the promotion for use of certain banks credit card. if you keep having server error for that then what for have the banks promotion in the first place.",okay realli frustrat check due server error second time experienc even clear cach log log uninstal reinstal server error still exist promot use certain bank credit card keep server error bank promot first place,2,1
Great buys so far!,great buy far,4,0
Easy to use and also chat with merchants before purchase. Has a huge array of items for purchase at cost saving prices. Great experience so far using this app.,easi use also chat merchant purchas huge array purchas cost save price great experi far use,5,0
"Get value times time to time. The most annoying is the games. Aside from that, good shopping app.",get valu time time time annoy game asid good shop,4,0
"Already deleted this app cos rarely use but still received verification code through sms, got a fright everytime thought someone hack and use my account.",alreadi delet co rare use still receiv verif code sm got fright everytim thought someon hack use account,1,1
I luv shopping at shopee! The best online shopping app..easy to use and affordable price👍👍👍,luv shop best onlin shop easi use afford price,5,0
"It is very easy to shop with Shopee and each purchase arrived in very satisfying condition. Refunds are prompt, hence, its reliability is unquestionable.",easi shop purchas arriv satisfi condit refund prompt henc reliabl unquestion,5,0
Out of so many app that I m using this app is the worst,mani use worst,1,1
A bit slow sometimes.. But overall is good,bit slow sometim overal good,4,0
Can get the best deal online shopping platform.,get best deal onlin shop platform,4,0
Downloading the app was easy. Not much info and stuff to fill up. The app make cash top up and buying transaction easy. There are lots of awesome deals everyday. The prices are competitive but many are reasonable. Always looking for the best deals at the best affordable price. There are also cashback and coins to win. There are many games that I can play and at the same win coins too. The games are fun and of a few variety. The daily and weekly $1 deal is always something I will look forward to.,download easi much info stuff fill make cash top buy transact easi lot awesom deal everyday price competit mani reason alway look best deal best afford price also cashback coin win mani game play win coin game fun varieti daili weekli deal alway someth look forward,5,0
"Easy to use, will use it again for online purchase. Thank you",easi use use onlin purchas thank,5,0
"Shopee is one of the top ecommerce shopping app to use. However, they should have a more stringent process of allowing China sellers to be on the platform. I have encountered many issues with China sellers, either received faulty item or send wrong item. Some are sincere in resolving but some are not., resulting a waste of money. Perhaps there should be a quality check on these sellers?",one top ecommerc shop use howev stringent process allow china platform encount mani issu china either receiv faulti send wrong sincer resolv result wast money perhap qualiti check,4,0
App is laggy when i'm inside for maybe >30mins?,laggi insid mayb min,3,1
Only a negative side is received goods box with dented conditions,neg side receiv good box dent condit,4,0
Fast service through this seller.,fast servic,4,0
worse.not userfriendly,wors userfriendli,1,1
"Most likely theres a lot of bias working for shopee.My listed item been deleted for several times but others had no problem which they are selling same type of carbon fibre stickers like me.even when i make a report there's nothing they'BIAS' do.Come on all the bloddy bias,quit your job and go sell newspaper",like there lot bia work list delet sever time other problem sell type carbon fibr sticker like even make report noth bia come bloddi bia quit job go sell newspap,1,1
Good for deals! I use it a lot these days,good deal use lot day,5,0
Good experiences with the sellers n delivery personnel that I've encountered so far! App is also easy to use!,good experi n deliveri personnel encount far also easi use,5,0
"App in general is easy to use and works ok, except it's unresponsive at times.",gener easi use work ok except unrespons time,5,0
Worst delivery service.,worst deliveri servic,1,1
hello im looking for shopee malaysia...cant find it in google play,hello im look malaysia cant find googl play,3,1
"After selecting the item, buyer should be able to enlarge and view the image. This is possible in other ecommerce platforms but not shopee.",select buyer abl enlarg view imag possibl ecommerc platform,4,0
Great experience. User friendly apps,great experi user friendli app,5,0
"Be careful, there is no customer service. App is very difficult to use.",care custom servic difficult use,1,1
Your customer protection policy is just toooooooooooo bad. prioritising scam sellers is a shame you fools.,custom protect polici toooooooooooo prioritis scam shame fool,1,1
"I receive a broken tempered glass. Took pic of it and immediate request with the 3 pics for a refund. A dispute email received instantly, asking for more proof! What other proof do u want from me? The pics are not clear enough? So far I never experience such with Lxzxdx.... If it's obvious, don't make things difficult for us. It only cost $3+, I can afford that... But don't make me spend hours for such refund. All the best Shopee.....",receiv broken temper glass took pic immedi request pic refund disput email receiv instantli ask proof proof u want pic clear enough far never experi lxzxdx obviou make thing difficult us cost afford make spend hour refund best,1,1
Better than most other platform,better platform,3,1
used to be good but now. always hang. many times apps unable to load page while browsing or only partial photos load.,use good alway hang mani time app unabl load page brows partial photo load,2,1
"Great app, lots improved since I first join. Though the lag these days are rather ignoring.",great lot improv sinc first join though lag day rather ignor,4,0
It always has an error when you try to add a credit card,alway error tri add credit card,1,1
Great app. Easy to use.,great easi use,5,0
Shopee is selling used products as brand new. I know for a fact because they rejected my return though I did not use it but I taped the box and they were unable to make the box look new again. They give honest consumers like us a false sense of security with their 15 days policy which meant it must not be tested out at all.So what's the point. They are using users as a click farms to falsify sales transactions.It's time another app with integrity to take over this useless app run by a bunch of a,sell use product brand new know fact reject return though use tape box unabl make box look new give honest consum like us fals sens secur day polici meant must test point use user click farm falsifi sale transact time anoth integr take useless run bunch,1,1
1)On time order status 2) Order received in Good condition 3) Prompt reply from seller,time order statu order receiv good condit prompt repli,5,0
Great online shopping with great purchases..👍👍👍,great onlin shop great purchas,5,0
Quite easy to use and make purchases.,quit easi use make purchas,4,0
Love the $1 draw. A very good online shopping app.,love draw good onlin shop,4,0
Enjoyed my shopping experience. And customer service was great too.,enjoy shop experi custom servic great,5,0
Good,good,4,0
Wonderful app to shop with.,wonder shop,5,0
Good place to find vast products and good pricing.,good place find vast product good price,5,0
The search function is useless.,search function useless,2,1
Hey can you stop sending notifications and I am uninstalling this and lazada is the best,hey stop send notif uninstal lazada best,1,1
Secure and responsive experience!,secur respons experi,5,0
Good deals found thru this app compared to others,good deal found thru compar other,5,0
"Preferred shopping app, come with quite a handful of free delivery.",prefer shop come quit hand free deliveri,5,0
shoppe is lame somebody report rignt now,shopp lame somebodi report rignt,1,1
Good,good,5,0
"Well designed app. However, i have been receiving many notifications. So far, I'm unable to find anywhere in the app to selectively turn-off the unnecessary notifications.",well design howev receiv mani notif far unabl find anywher select turn unnecessari notif,5,0
"Good app, easy to navigate and deals were great. However, Vouchers were better in the past, hope to see more attractive vouchers soon!",good easi navig deal great howev voucher better past hope see attract voucher soon,4,0
Very easy to use. Lots of products at great prices.,easi use lot product great price,5,0
"Please fix the payment page I had been a frequent user of this app. I can't 
make payment cause of the loading page. It takes forever to load but 
nothing comes out. I even deleted the app and redownload it again but still 
do not work!",pleas fix payment page frequent user make payment caus load page take forev load noth come even delet redownload still work,1,1
Service very good and efficient,servic good effici,5,0
The app crashed for the whole day already. Still not fixed? Can't seem to open it at all despite uninstalling and installing over and over. Please fix,crash whole day alreadi still fix seem open despit uninstal instal pleas fix,2,1
"some stuffs purchased from Shoppee, received it, alots stuffs de quality not so good, want me apply for refund, i can't get the refund, e seller also can't help me much",stuff purchas receiv alot stuff de qualiti good want appli refund get refund e also help much,3,1
Very good,good,5,0
Good experience so far,good experi far,4,0
Good price. Happy with all the purchase,good price happi purchas,5,0
"so far, a great platform to shop for home essentials. purchase a lot of items from this site.",far great platform shop home essenti purchas lot site,5,0
"Can't seem to get through the last step ""address"". Tapping on the skip button doesn't work. Just stuck at that screen. Pls check. Tks",seem get last step address tap skip button work stuck screen pl check tk,3,1
It's been a good app always. Super cheap stuff. But today the app is crashing. Items in cart aren't shown. Tried to buy stuff. But keeps prompting that the cart is empty,good alway super cheap stuff today crash cart shown tri buy stuff keep prompt cart empti,3,1
Simple and easy way to shop,simpl easi way shop,4,0
Good access platform to shop,good access platform shop,3,1
Generally easy to use. Some lagging occurred when i was trying to key in sone promo codes,gener easi use lag occur tri key sone promo code,4,0
Good experience so far.,good experi far,5,0
"Even the daily rewards has been cut, is this how Shopee reward it loyal customers???😠😠😠",even daili reward cut reward loyal custom,2,1
Very good,good,5,0
Canot get well conection,canot get well conect,3,1
Conducive to use.,conduc use,4,0
Overall fast response but sometimes lag on certain pages,overal fast respons sometim lag certain page,4,0
Shopee has good and better deals than some other online shop apps esp the prices of products. Delivery service also one notch faster.,good better deal onlin shop app esp price product deliveri servic also one notch faster,5,0
Good shopping experience.,good shop experi,5,0
Buying something on Shopee from China takes 3 weeks to receive item. I bought same item from other platform sent out from Australia and I receive the item within a week. I think the delivery is probably done on bicycle.,buy someth china take week receiv bought platform sent australia receiv within week think deliveri probabl done bicycl,1,1
Very good service and their silky smooth clothes.,good servic silki smooth cloth,5,0
Alternative e shopping platform!,altern e shop platform,4,0
Good and easy to use.. fast delivery and reliable,good easi use fast deliveri reliabl,5,0
Love shopping on shopee,love shop,5,0
So far this is reliable and shipping from overseas usually take a week or about 9 days upon ordering. Only downside is the tracking of the parcel is not accurate.,far reliabl ship oversea usual take week day upon order downsid track parcel accur,4,0
Noice cheap stuuffs,noic cheap stuuff,4,0
Shopping with Shopee app is very good. Deals are very good and milloins of items to Shop.,shop good deal good milloin shop,5,0
User friendly. No gimmicks.,user friendli gimmick,4,0
"Good shopping experience, easy interface",good shop experi easi interfac,5,0
I'll appreciate lessee notification.,appreci lesse notif,1,1
Easy peasy and loving the service I got from Shopee. Fast & accurate.,easi peasi love servic got fast accur,5,0
they don't allow refunds for defective goods,allow refund defect good,1,1
Very difficult to go through payment procedures using shoppie pay refund/ to transfer $$$from shoppe pay to bank account,difficult go payment procedur use shoppi pay refund transfer shopp pay bank account,1,1
hi I would like to have warranty after the item receive . At less 2week . even they Don have warranty it was unfair to us,hi would like warranti receiv less week even warranti unfair us,3,1
Provide different varieties of stuffs,provid differ varieti stuff,5,0
So far so good,far good,4,0
Have not try but looks interesting..,tri look interest,3,1
The price is attractive and so far products received were in in good condition.,price attract far product receiv good condit,5,0
Recently been having alot of lagging and payment problems with this app... Sometimes the screen will go super zoomed in that u only see 25% of the actual screen and u cant do anything about it. And whenever i tried to pay for my orders it always said payment failed.... Alr tried 4 times the same order and still the same result.. Its not my bank problem definitely i already checked....pls fix this asap,recent alot lag payment problem sometim screen go super zoom u see actual screen u cant anyth whenev tri pay order alway said payment fail alr tri time order still result bank problem definit alreadi check pl fix asap,1,1
"The notifications were getting annoying. Yes, I could turn it Off in Preferences but it was default On. The number of messages is ridiculous. Uninstalled.",notif get annoy ye could turn prefer default number messag ridicul uninstal,2,1
Might find some great deals during flash deal,might find great deal flash deal,4,0
"I like Shopee, and shopping here more cheap and alot discount.",like shop cheap alot discount,5,0
All seller i encounter i give 5 star..😁👍,encount give star,5,0
Good online site with user friendly interfaces. Easy to use. 👍,good onlin site user friendli interfac easi use,5,0
hassle free,hassl free,4,0
Great shopping experience!,great shop experi,5,0
Very enjoyable shopping experience,enjoy shop experi,5,0
Unable to connect google account,unabl connect googl account,1,1
Buyers be careful. Cannot trust ratings on Sellers shop!!! Because Seller can hide bad review ratings and only show good ratings. Don't understand why shopee allow this :(,buyer care cannot trust rate shop hide review rate show good rate understand allow,1,1
Good,good,4,0
Very good 👍,good,5,0
Improve a lot compare to my last purchase experience long time ago. 👍,improv lot compar last purchas experi long time ago,4,0
need to be more organised,need organis,4,0
I hope all seller send out items to be fast. N items be in good conditions. Overall OK accept for the waiting duration.,hope send fast n good condit overal ok accept wait durat,3,1
"Make shopping convenient. Plus it will deliver straight to your home address. Also there is given extended warranty before releasing the payment over the seller But now, im not happy at all, 3 products in total i ordered that I didn't received. So, the satisfactions turns to be dissappointment. Bye Shopee...will let go of you now",make shop conveni plu deliv straight home address also given extend warranti releas payment im happi product total order receiv satisfact turn dissappoint bye let go,3,1
Alot of scammer. Did not received my product but the state put complete.,alot scammer receiv product state put complet,1,1
So far so good!!!,far good,5,0
Good platform to find great deals and awesome promotion! Love it best with the credit card partner's promotion! Way to go Shopee!,good platform find great deal awesom promot love best credit card partner promot way go,5,0
User friendly. Easy to navigate. Have been using Shopee to do my online shopping.,user friendli easi navig use onlin shop,5,0
Reliable and fast. Was delighted with the service :),reliabl fast delight servic,5,0
Good products! Fast Delivery. Highly recommended👍👍👍,good product fast deliveri highli recommend,5,0
Give me a hard time about the shipping address when I put my full address still ask me about my postal code ??????😤😤😤😤😤,give hard time ship address put full address still ask postal code,1,1
Convenient n Safe shopping!! Thank you.,conveni n safe shop thank,4,0
Addicted,addict,4,0
A great interactive shopping app with fun games to win discount vouchers and $1 lucky draw.,great interact shop fun game win discount voucher lucki draw,5,0
"Works well for me. Many good deals in Shopee app although there are some bad deals where retail shops are much cheaper, probaably due to value density.",work well mani good deal although deal retail shop much cheaper probaabl due valu densiti,5,0
Excellent,excel,5,0
Good apps with good deals.,good app good deal,5,0
Soooooo slow. I've been trying to install for an hour for an urgent purchase. Invest on your app and service before spending tons of money on advertising!!,soooooo slow tri instal hour urgent purchas invest servic spend ton money advertis,1,1
Going to uninstall this after I received my items. My card seems to be used for unauthorized purchase after shopping at Shoppee.,go uninstal receiv card seem use unauthor purchas shop,1,1
The search bar does not work. Clicking search will only bring you back to the homepage,search bar work click search bring back homepag,3,1
Good shopping fast delivery,good shop fast deliveri,4,0
Some items can be found cheaper. Easy to use too.,found cheaper easi use,5,0
A fuss-free online shopping experience,fuss free onlin shop experi,4,0
"The software itself is good but help center is not good enough. If sellers sent wrong item to you and you ask for refund, Shopee will tell that item is correct and rejected your request. DO NOT RECOMMEND BUYING ON THIS PLATFORM",softwar good help center good enough sent wrong ask refund tell correct reject request recommend buy platform,2,1
User friendly app with added feature of shipping details 👍,user friendli ad featur ship detail,5,0
Lousy customer service from Shopee. sent an email to ask for help regarding missing parcel. but didnt even bother to reply me. all i got was automated reply from shopee. I would use other platform like qoo10 and lazada who provides better service from now on.,lousi custom servic sent email ask help regard miss parcel didnt even bother repli got autom repli would use platform like qoo lazada provid better servic,1,1
Good,good,5,0
Quite good buys here. Only the coupon is abit irrelevant at times.,quit good buy coupon abit irrelev time,4,0
"*Edit* Thanks for the reply, am still unable to access your main website even after trying to create a new account. You have just lost a customer trying to buy an Xbox.",edit thank repli still unabl access main websit even tri creat new account lost custom tri buy xbox,1,1
New update become so lag. Will put 5 star when this fix,new updat becom lag put star fix,1,1
Worst Advertisements On YouTube,worst advertis youtub,1,1
"My purchased product arrived soon, great! However, my free welcome package was not delivered and eventually be cancelled by Shoppe. I asked for compensation but no asnwer at all! Very lousy!",purchas product arriv soon great howev free welcom packag deliv eventu cancel shopp ask compens asnwer lousi,4,0
"More a lot choice than other shopping online, some more cheaper but some olso more expensive",lot choic shop onlin cheaper olso expens,4,0
"S-Mart sucks! DO NOT ORDER FROM THEM! I ordered on 27 Apr, expected to receive 3 May, but nothing received till now, 13 May. When i chat with Live Agent, instead of checking 1st, they suggest i click refund. But i want the items! Said they will check, but no update few days later. When i asked again, they tell me to refund again without giving reason. Guy from J&T Express also called & asked, gave them details and now no reply at all despite me repeatedly asking them for update over 1 week.",mart suck order order apr expect receiv may noth receiv till may chat live agent instead check st suggest click refund want said check updat day later ask tell refund without give reason guy j express also call ask gave detail repli despit repeatedli ask updat week,1,1
Tried two sellers but both have rather long lag time to ship after confirmation of order. One 9days the other still pending. Looks like the sellers have to be screened more carefully.,tri two rather long lag time ship confirm order one day still pend look like screen care,3,1
"I was suddenly logged out. Asked to log back in. When i did, all my current orders and prev orders were all wiped out. So now i have no idea what has happened to my orders that are all in the process of shipping",suddenli log ask log back current order prev order wipe idea happen order process ship,2,1
Just type what you want and should be able to find,type want abl find,4,0
"Good app but layout could be better , and the notifications should improve. Sometimes they just randomly shouted shopee which was a bit intimidating to me.",good layout could better notif improv sometim randomli shout bit intimid,4,0
"a very good shopping platform that i will always use on a daily basis. many cheap deals!! -1 star is because with the recent updates, Shopee very stingy with coins and also lesser vouchers given nowadays. when they give u voucher they increase the min. spending require to use the voucher 🙄",good shop platform alway use daili basi mani cheap deal star recent updat stingi coin also lesser voucher given nowaday give u voucher increas min spend requir use voucher,4,0
Good,good,4,0
Why delete my accoubt,delet accoubt,1,1
Trustable site but variety is limited,trustabl site varieti limit,4,0
Good,good,4,0
Good and informative service including delivery information 👍,good inform servic includ deliveri inform,5,0
this is a stupid shopping 😡 app i order always cancels my order . and hold my money .,stupid shop order alway cancel order hold money,1,1
It's been a good shopping experiences so far.,good shop experi far,4,0
The shopee wallet page keeps loading but nothing comes out. How am I supposed to access to the money there???,wallet page keep load noth come suppos access money,1,1
"Competitive shopping platform, I keep coming back for best price and rewards (vouchers and coins).",competit shop platform keep come back best price reward voucher coin,5,0
Consider good app at beginning stage.,consid good begin stage,4,0
There are some faulty products not refunded but most deals are good,faulti product refund deal good,4,0
ITS HELPFUL,help,5,0
The app has been crashing since the update and I still have an order that has yet to reach me so it's really frustrating to not be able to check on it !! I can't even enter the app now.,crash sinc updat still order yet reach realli frustrat abl check even enter,2,1
Customer service does not even type properly. Despite founder educated in SG. T & C voucher is a joke. Better apps out there. Even Ali express is doing a better job. And now the other voucher disappeared despite expiry on 16.9.19 total fail app!,custom servic even type properli despit founder educ sg c voucher joke better app even ali express better job voucher disappear despit expiri total fail,1,1
Fantastic,fantast,5,0
Stupid app can't even log in waste my time,stupid even log wast time,1,1
Love the shopping experience and bargains!!!,love shop experi bargain,5,0
The app keeps saying that i have a network error but my network was stable. I am unable to receive my welcome package,keep say network error network stabl unabl receiv welcom packag,3,1
The best servis,best servi,5,0
#ShopeeScam,shopeescam,1,1
"easy to use and user-friendly app. but need to work on their customer service/help centre, and also their ""refer a friend"" promo codes",easi use user friendli need work custom servic help centr also refer friend promo code,4,0
"Nice to use, now attractive price",nice use attract price,5,0
Easy & convenient way of buying many things online via shopee.,easi conveni way buy mani thing onlin via,5,0
I was so happy with this online shop. thanks shopee sg. please continue your good services with your customers. god bless you...,happi onlin shop thank sg pleas continu good servic custom god bless,5,0
Does not work,work,1,1
I like this app but after sometime it doesnt load properly. I cant purchase anymore.,like sometim doesnt load properli cant purchas anymor,2,1
This is just a note to self. Not good for selling stuff. Don't download again.,note self good sell stuff download,3,1
Great communication and wide range of products.,great commun wide rang product,5,0
Feel safe with my money when shopping online. Great apps. Thank you.,feel safe money shop onlin great app thank,5,0
